id,userId,restaurantId,overallRating,foodRating,serviceRating,ambienceRating,valueRating,wyr,text,date,partySize
243,"15","23","5","5","5","5","5","1","Asperiores vel sunt est aspernatur quis. Est laboriosam dolores. Corporis magni error aut vel beatae dolores quasi. Earum inventore earum tenetur ab quis pariatur. Aut aut incidunt provident repellat est vero sequi ut. Vel maiores deleniti ipsa eveniet in. Cumque hic sapiente fugit.

Ut officia impedit consequatur. Blanditiis nulla et a sint aut. Quia fugiat nobis fuga ea quas repellendus sapiente officiis. Ut accusantium consequatur alias. Sit voluptatem sunt ex.

Ipsum dolores dicta soluta. Ex et itaque quas laborum sunt corporis. Sit dolores est. Et assumenda sit nulla facilis est autem id.

Ut labore doloremque accusantium deserunt et omnis nesciunt doloremque. Quasi inventore eum ut quia repudiandae ut sed itaque aliquid. Consequuntur quia cupiditate. Rerum asperiores quia nihil. Modi quis consequatur nulla.

Alias sit neque iure est ipsa. Illum repellat maxime quibusdam cum. Repellendus culpa et aperiam ut ad non exercitationem. Rerum corporis sit doloribus recusandae. At et consequuntur. Sit qui et.","2017-10-25 06:10:57","3"
244,"94","23","3","5","3","5","5","1","Dicta est aut. Sed ut repellat vitae voluptatem exercitationem amet et ab. Quidem quo id voluptatem beatae. Illum doloremque voluptatem. Sit minus aut. Dolorem esse aut dolorem libero cumque eum. Laboriosam consequatur libero. Dolorum quae praesentium id vero odio.

Autem voluptate modi qui quod perferendis sint ipsum. Vitae sit veniam vel aut. Unde voluptas incidunt aut sit repellat enim. Voluptatum et non cupiditate est aspernatur consectetur.","2018-08-23 14:08:39","5"
245,"57","23","5","5","3","4","4","1","Non voluptatem corporis eos fugit modi ipsum inventore modi. Reiciendis facere veritatis sed iure.

Soluta odio tenetur voluptas. Et molestiae ut labore eos eaque pariatur quidem. Qui qui velit dolorum quidem recusandae. Autem nisi reiciendis ipsum rem nihil ex perspiciatis.

Magnam nihil ipsum non perspiciatis quod quo omnis iure. Neque possimus qui distinctio ad et tempora vel animi itaque. In quia et autem. Adipisci ratione temporibus aut et sed qui esse accusamus velit. Est atque quidem rerum eaque incidunt. Beatae maiores ab. Sapiente deserunt quidem doloribus id qui aliquam cum ad architecto. Quisquam quas ea nihil labore natus.","2018-01-06 03:01:65","3"
246,"51","24","5","4","5","3","5","0","Aspernatur qui voluptas non odit. Dolor doloremque incidunt pariatur asperiores quisquam praesentium nihil. Deserunt nesciunt occaecati in aliquid aut ducimus et fugiat. Harum modi consequuntur sint voluptatem nemo qui beatae perferendis et. Est accusamus voluptas explicabo sit. Nostrum accusantium autem magni unde doloribus.

Nam rerum ea nesciunt sequi velit voluptate magni. Est unde architecto aperiam inventore omnis corporis dolorem repudiandae. Id fuga qui tempora itaque voluptatum earum qui. Aliquid distinctio ea incidunt doloremque ab aut. Earum beatae nemo quo eveniet consequuntur similique.

Velit et error placeat eius omnis. Aut et assumenda laudantium explicabo veritatis rerum. Nihil aut et eum. Deserunt nulla facilis error et laborum. Esse consequatur eum quas id consectetur omnis aliquam sint.

Enim sunt doloremque. Vel deserunt autem. Quia id eligendi aut. Cupiditate facilis deserunt repellat molestiae deserunt nam voluptas. Eos sed minima sit explicabo.

Error quaerat ea doloribus repellendus accusamus facilis quam officia. Nisi aut aut nemo consequatur dolorem quis qui. Eius dolorum inventore et veritatis perspiciatis aut. Ea eaque tempore aut sed eos consequuntur odio. Est quam beatae.","2018-01-18 03:01:99","3"
247,"41","24","5","4","5","5","5","1","Nesciunt ea deleniti maxime. Dicta error qui consequatur sapiente provident et atque. Rerum non nam nisi qui sequi id beatae.

Non repudiandae est illo quod aut vitae dolores consequatur ut. Debitis aliquam tempora assumenda autem consequatur doloribus accusantium et. Ut sit suscipit. Inventore commodi delectus repudiandae et est amet dolorem est perferendis.","2018-06-25 14:06:41","5"
248,"26","24","4","3","5","5","5","1","Minus aperiam rerum unde. Iste ipsum suscipit eaque debitis itaque amet magni. Omnis voluptatem vitae qui quae fuga occaecati quisquam reiciendis. Debitis laborum rerum dignissimos ratione voluptatibus nostrum consequuntur quidem quae. Maxime natus voluptatibus inventore aliquid doloribus in perspiciatis magnam ut. Ut expedita voluptas numquam. Eveniet voluptatem mollitia aut ut exercitationem. Cumque deserunt itaque.

Quo ea ad illo alias. Enim itaque consectetur. Odit illo magni exercitationem.

Eum earum odio dignissimos sed blanditiis doloremque similique maxime. Qui excepturi voluptatem eum vero deserunt. Voluptatum explicabo voluptas reprehenderit et necessitatibus dolorum. Qui nobis non et cupiditate consectetur fuga. Delectus aut eaque deserunt ea non non.","2017-12-27 02:12:65","7"
249,"82","24","5","5","5","5","2","1","Incidunt omnis aperiam cupiditate perspiciatis dolore sit quibusdam. Similique et odio consectetur qui. Consequatur omnis iusto.

Ut sit sed consectetur eaque soluta architecto. Ut qui ut eum omnis quos eligendi. Enim aut corrupti iure veniam aut animi qui. Esse est dignissimos iusto voluptate quod repellat placeat consectetur. Maiores adipisci sint laborum sed voluptas dolore molestias magnam aut.

Beatae iste eos adipisci quisquam. Eveniet id voluptas et repudiandae veniam sequi sit sed. Odio non animi et quae architecto aut.","2018-07-24 09:07:94","6"
250,"21","24","4","3","5","4","5","1","Ut possimus velit saepe deserunt. Voluptate molestias minima a amet doloremque ut nam vel. Enim dignissimos nihil. Repudiandae eos recusandae placeat ducimus quas quasi.

Et itaque occaecati odit quasi in autem velit. Aut sit in est ex molestias dolorum. Neque nulla omnis amet provident cumque. Velit est aut impedit harum accusamus laudantium quia ad rerum. Ipsa dolores rerum. A aliquid earum et non omnis enim recusandae.

Rem ea vel nobis maxime itaque debitis. Similique corporis asperiores quae illum officia delectus quaerat possimus nemo. Dolore esse voluptatem aut et accusantium rem illum quo. Quidem dolores eligendi quibusdam. Error quos illum. Nobis similique velit ea nostrum doloribus delectus.

Et corporis adipisci autem. Qui qui ea molestias sequi accusamus officia consequatur.

Et corporis quia provident harum et consequatur voluptatem et. Distinctio ut occaecati ipsum dolorem quisquam. Id rerum facilis vel quo hic ut sit saepe. Laboriosam vero est sint beatae voluptatem vitae alias. Quidem tempore rerum ea maiores ut qui. Maxime nulla odit omnis omnis earum. Sunt voluptatem dolorem.","2017-12-14 23:12:36","6"
251,"82","24","5","5","2","4","2","1","Molestias quos ea velit non. Quam et sit. Ex nihil sequi. Est aut vel explicabo voluptatibus non culpa cumque ad. Tenetur facilis qui modi sunt quidem placeat voluptatem repudiandae. Error quas veritatis in sequi.

Placeat cupiditate non voluptatibus doloribus animi quis qui id quia. Ut voluptatem sit.

Maiores sapiente quia ea. Sit veniam consequatur iure dignissimos. Eius qui velit. Voluptatem ut similique minima. Sed et cupiditate aut dignissimos.","2018-04-08 19:04:42","2"
252,"85","24","4","5","5","5","5","1","Recusandae aut porro nihil quis modi dolor nisi a deleniti. Maxime delectus est nostrum. Fuga quam porro maiores quis et perferendis. Dolore eaque voluptates rem itaque enim doloremque eaque est hic. Autem at tempora possimus quis autem. Dolor culpa ut modi qui non sint error et dolor.","2018-08-30 04:08:96","8"
253,"91","24","4","5","5","4","5","0","Perspiciatis sunt explicabo molestiae nulla repudiandae. Vitae accusamus qui doloremque ipsam in voluptatem nisi assumenda reiciendis. Nulla et ea. Voluptatem et aut expedita sint ut magnam.

Asperiores et et sit mollitia optio sequi aperiam dignissimos et. Aut molestias alias voluptatum et. Voluptatibus eum quisquam consequatur. Temporibus consectetur libero labore cumque aperiam dolorem eum et ut.","2018-02-07 19:02:08","4"
254,"86","24","1","5","5","5","5","1","Eius necessitatibus itaque occaecati ut eligendi officiis nesciunt voluptas omnis. Et facere voluptates vitae dicta a amet suscipit. Corporis officiis cum et numquam natus sint eligendi corrupti voluptatum. Ipsum rerum nihil cupiditate rerum. Culpa dolores tempora ipsa sint eaque est. Recusandae aut consequatur qui hic eos dicta eius. Cumque excepturi delectus distinctio praesentium dolores sunt delectus quas accusantium.

Voluptatem aut dignissimos dolorum sequi voluptates. Et alias repudiandae voluptate repellendus debitis quis. Totam qui laborum. Quia nihil aut molestiae est voluptatem inventore voluptas.","2018-05-24 21:05:76","2"
255,"3","24","5","2","4","5","5","1","Delectus occaecati aut laudantium libero neque eum voluptate sed tempore. Optio nemo architecto et cum neque ab. Odio illum quaerat. Exercitationem enim consequatur blanditiis et dolor id totam. Provident a voluptas. Doloribus et esse sunt. Consequuntur non consequatur non sunt quod dolorem rerum doloribus modi.

Id maiores mollitia veniam enim qui est est et est. Magni minima sint et corporis reprehenderit.

Et mollitia velit consectetur nulla est. Est beatae qui nostrum impedit fuga minus consequatur eum reiciendis.

Enim non cum. Deserunt iure vero occaecati cum. Quis voluptatibus aut impedit consequatur harum voluptas ex rem. Explicabo tempore eos. Illo hic id est inventore cupiditate ducimus cum quia ut. Corrupti possimus blanditiis.","2017-11-08 17:11:46","2"
256,"74","24","5","4","5","5","4","1","Ab dolor unde culpa. Velit dolores dolor veniam ut odio. Sapiente quos facilis aut velit a sed ea et blanditiis. Et sequi sint ut officia libero sunt illo illo nisi. Distinctio aperiam cum quisquam illo repellat eius culpa. Facilis sunt molestiae. Amet labore nihil voluptates sit quam autem sunt et. Iure dolorum qui doloremque.

Rem nisi quia magni sed ipsa ipsa voluptatum dolor. Ex officiis consequatur incidunt omnis aliquid exercitationem facere est. In incidunt ea sapiente qui hic facere. Animi earum esse est quibusdam animi delectus. Porro sed aut. Et at repellat inventore.

In voluptas ipsa rem iure quibusdam corrupti commodi. Iste velit unde voluptatum accusantium voluptas sunt voluptatum. Occaecati sunt qui laudantium distinctio nemo sed ipsam voluptatum. Et fuga qui et. Eius ratione quaerat ut reiciendis hic.

Quo ab eius reiciendis harum voluptatibus quam deserunt. Numquam nobis maxime at tempora. Quos sequi neque voluptatem aliquam asperiores. Animi voluptas blanditiis iste sed omnis molestiae maxime recusandae culpa. Fugiat laudantium totam praesentium soluta quae dolorem.

Eum culpa eaque quia. Qui qui itaque veniam ut aut aut accusamus omnis eos. Amet libero dignissimos aspernatur molestias rerum quaerat placeat fuga. Consequatur tempora temporibus ea eos odit. Asperiores quae molestias. Accusamus non totam eligendi omnis. Optio occaecati rem dolorem fugit voluptatum et quos.","2018-06-22 18:06:90","5"
257,"43","24","1","4","5","5","4","1","Iusto illo quia beatae. Corrupti quis esse aut. Aut dolor corporis nisi sit in consectetur. Voluptatem nesciunt illo ut soluta atque illo qui temporibus. Ratione beatae nostrum sapiente aliquam animi.","2018-08-30 08:08:79","8"
258,"8","24","5","5","5","5","5","1","Consequatur sed repudiandae ipsa maiores minus qui. Consequatur suscipit autem. Quia vero qui aliquid quidem voluptatum sunt quia facilis. Quas porro perferendis eaque.

Dolor vitae omnis cum voluptatibus omnis officiis ut. Inventore qui voluptas doloremque quia sapiente eveniet quae pariatur. Nostrum omnis veritatis nesciunt tempore quae voluptatem voluptate ab dolorem.

Aliquid commodi aliquam accusamus ducimus. Cum rerum ut fugit nihil fugit illum. Iusto omnis autem amet est est expedita. Eos blanditiis fuga dolorem labore adipisci quia ad. Adipisci cum et at.

Ipsam qui quam eveniet impedit. Vero ipsum et perspiciatis aliquid officiis delectus a. Sit sapiente distinctio. Sit blanditiis dicta repellat a. Qui nihil incidunt eos aliquam rerum aut quo saepe quas. Deleniti omnis culpa sint in cum eos qui non.

Laudantium tempore sit voluptatem optio at et distinctio eveniet. Quam id aut ipsam non omnis. Dolor velit cupiditate vel praesentium. Rerum maiores nulla ab facilis aut ut quae.","2018-03-18 01:03:96","6"
259,"46","24","5","4","4","4","3","1","Quia inventore error ipsum aliquam. At asperiores aperiam aut dicta. Ut quidem incidunt voluptas voluptas dolore nostrum. Ipsa eos vero ratione tenetur corporis eveniet repellat. Officia ipsam aliquam excepturi.

Suscipit minima labore eaque voluptatibus. Architecto voluptatum ut. Nisi eos natus omnis ea culpa deserunt ut fuga. Non incidunt numquam rerum. Ut eius vel id qui et rerum sint. Corporis aut facere accusantium.","2018-07-14 13:07:40","3"
260,"62","24","4","5","5","5","5","1","Aperiam qui molestiae cupiditate. Ea quo temporibus eos. Magni id et temporibus. Optio sequi hic aut est veritatis. Nemo et est in et id. Placeat ipsa consectetur et.","2018-04-14 01:04:23","6"
261,"26","25","5","5","5","5","2","1","Aut aut dolorum qui sint sit sed ratione necessitatibus nihil. Dignissimos est vel. In repellendus corrupti adipisci consequatur perferendis. Ea id enim qui modi consectetur laudantium cupiditate iste incidunt.

Labore impedit harum enim est animi eum. Molestiae asperiores consequatur similique laboriosam. Quo est quisquam possimus et dolores. Corrupti autem quisquam ullam reprehenderit quos voluptas voluptates quis doloremque.

Quam perferendis nam. Voluptate molestiae nobis autem eos hic eveniet quaerat tempora. Corporis omnis nemo repudiandae doloremque vel qui. Aut dolores consequatur est iure. Est vel expedita iusto iusto beatae deserunt dolore qui. Aut ducimus quibusdam officiis quia molestias.

Sint ipsum nam doloribus facilis est. Aut qui aperiam. Voluptatem dolores maxime adipisci eos perferendis doloremque commodi. Quia ipsa quo. Cumque exercitationem eum non ad quasi quis. Officia minus ut. Molestiae et necessitatibus nam fugiat vel quo corrupti et praesentium.","2018-01-17 04:01:96","3"
262,"85","25","5","4","5","4","3","1","Laboriosam dicta exercitationem quo minus aut. Eos omnis id quia velit nulla maxime et nihil. Magni sapiente esse fuga cupiditate incidunt ut quasi. Error quod et facilis non non eum repellendus id doloremque. In vero dignissimos officia. Autem libero consequatur rerum dolore voluptatem dolores. Officiis ut laudantium ut esse ut accusamus.

Vel asperiores doloribus eos. Iste minima animi aut facilis culpa ipsum provident animi blanditiis. Omnis nisi ut aut ut eos.

Totam suscipit voluptatem est molestiae enim nulla aut. Nisi et consequuntur sit neque porro. Sapiente deleniti qui rerum tenetur alias commodi distinctio fuga est. Perspiciatis incidunt exercitationem. Ut laudantium aut sapiente dolorum aut nostrum omnis provident quibusdam. Animi iure incidunt possimus itaque inventore consequatur et.

Debitis dolores explicabo. Amet voluptate quo odio repellat ut corrupti qui reiciendis. Cum totam distinctio qui. Enim sunt voluptas ab. Quaerat et molestias.

Repellat voluptatum fugiat corporis pariatur consequatur error laboriosam. Quibusdam eveniet qui quas iure repudiandae praesentium. At blanditiis laudantium. Non vel ut perferendis sapiente sit aut fuga quia distinctio. Aut voluptates ut eum sunt quos eligendi laboriosam. Animi facere delectus quas non velit sed illum. Atque optio voluptatem et nihil et et reiciendis. Illo earum doloremque.","2018-05-14 23:05:32","3"
263,"85","25","1","5","5","5","5","1","Voluptatem qui molestiae ex. Explicabo alias culpa qui eligendi iusto aut fugit et iure. Qui non et et. Sed sed suscipit amet facere. Quam mollitia architecto modi nulla ut. Quas ut cumque magni nulla eum quaerat et iusto. Vel soluta ab eveniet.

Omnis unde sit et praesentium. Rerum optio commodi et odit laboriosam necessitatibus non. Ut dolorem cupiditate quae in accusantium ratione. Ut nostrum consequatur exercitationem libero tempora quidem similique odit. Quibusdam est magnam exercitationem perspiciatis quis. In repellendus aut praesentium ipsum rerum sed doloremque.

Perferendis sit et facere numquam fugit itaque. Aut error similique at dolore aperiam voluptas. Enim qui mollitia quos rem cumque.","2018-07-06 04:07:25","6"
264,"50","25","4","5","5","5","5","1","Et animi molestias voluptate. Et ad quas reprehenderit voluptas cum. Aperiam magni ut nihil corrupti qui aut aut est alias. Laborum unde aut aliquid dolore. Aliquid qui ea. Nobis hic iusto voluptates sapiente.

Nemo voluptatibus amet molestias nostrum ea ad omnis nostrum. Totam aperiam optio deleniti est vitae. Similique id modi. Excepturi natus laborum esse earum modi ratione incidunt ut sunt. Enim ea sequi cumque sequi. Et ut corporis.","2018-07-29 01:07:47","5"
265,"28","25","4","4","2","5","5","0","Corrupti nulla laudantium omnis aut nisi. Velit alias cumque. Aliquid magnam aspernatur maiores unde amet. Inventore qui ipsa voluptatem inventore iure voluptas et.

Optio labore eos omnis earum natus quia vel nulla voluptates. Quo ut veritatis. Dolor voluptas neque esse esse neque et occaecati autem blanditiis.

Reprehenderit consectetur ex fugiat atque minus. Dignissimos ea delectus odio molestiae modi. Aut vel vel. Est voluptatem quo fugiat inventore ratione voluptatem. Et explicabo voluptatum et quam natus veniam sed. Voluptatibus qui nulla laboriosam eius quo itaque.

Praesentium impedit voluptatum sit repellat eum. Non eligendi autem eum totam. Eum asperiores explicabo sit esse exercitationem voluptate aut sapiente cumque. Impedit ea ullam tempore asperiores quibusdam nemo. Qui expedita rem similique vitae qui a asperiores. Repudiandae explicabo minima eos culpa dolor et rerum. Blanditiis aspernatur aut et repellendus eligendi aut aut.

Ut similique perferendis voluptatibus qui qui et voluptate aut vel. Qui quidem suscipit sit expedita. Fugit neque ut vel est voluptate officiis. Architecto est omnis. Quia aut dolor facere hic quidem est qui laborum illo. Earum amet dolores exercitationem at voluptate omnis ut eius molestias. Magnam sunt esse.","2017-11-25 09:11:70","8"
266,"58","25","1","5","3","4","5","1","Ut mollitia nihil asperiores. Ut earum velit aut aspernatur dolorum alias voluptas. Qui inventore perferendis nesciunt quaerat corporis ipsam quidem. Quaerat alias facilis voluptas ea. Quidem libero maiores.

Et eos sunt libero ut error. Perferendis eos earum qui amet et aut. Accusamus aut earum tempora sunt quo officia nam. Enim aspernatur est quia sed quidem dicta voluptatem. Quae vel necessitatibus veniam id soluta cum neque necessitatibus. Blanditiis aut et voluptatem doloribus eveniet sit consectetur. Quisquam id mollitia est. Sequi fuga dolores.

Voluptatem et maiores. Et ipsum fugit laudantium aut et quia exercitationem nemo. Doloribus magni cupiditate vero. Iure ad nemo aut impedit enim non qui.","2018-01-23 18:01:28","4"
267,"46","25","5","5","5","5","5","0","Qui praesentium sit ut rerum. Sequi sapiente quis consequatur illo veniam aut. Error sint omnis impedit vitae. Et saepe adipisci quo impedit soluta fuga. Omnis ut quidem omnis veniam eos. Mollitia sit enim eaque vitae alias fugiat ut non nam.

Itaque quidem sed aperiam in cumque. Nostrum quam officiis. Deserunt labore maiores mollitia harum.

Recusandae eum pariatur quasi et aspernatur nobis. Accusantium ipsam impedit blanditiis expedita aut voluptatem. Reiciendis nobis possimus. Laboriosam labore qui provident repudiandae rerum maiores repudiandae officia.","2018-05-27 21:05:99","5"
268,"13","25","5","5","4","5","5","1","Id non tempora pariatur distinctio sequi cupiditate ad. Et commodi voluptate animi dicta molestiae molestias. Mollitia sit similique facilis cupiditate facere incidunt. Aliquid ipsum minima pariatur tempora consequuntur. Repudiandae totam quia aliquam architecto unde.

Voluptatum non tenetur. Ut aliquam ad error dolore et omnis. Cupiditate voluptas saepe quo molestiae quidem.

Non et temporibus doloremque hic officia laudantium et non vitae. Quos omnis eos expedita vel earum veritatis voluptatem ut. Ea iusto nemo omnis. Ipsum ex accusantium illo quia consequatur. Est voluptas eius et in eligendi saepe non omnis tempora. Nesciunt aut dolorum similique.

Nobis quos repellendus corrupti quia alias eaque omnis pariatur aut. Et qui odio molestiae non odio eveniet. Rerum et deleniti. Blanditiis ut maiores odio ab fuga totam et. Modi aut ratione veritatis eum fuga alias adipisci. Nemo sequi expedita fuga. Sed ut dolores velit eius. Blanditiis dolores quis neque id.

Et ut aut. Eos eius voluptates facere. Qui dolorem iste. Ratione in quidem quia quia dolorem quae nobis. Delectus corrupti saepe maxime magni enim dolores suscipit.","2018-02-19 19:02:99","6"
269,"28","25","3","4","5","1","5","0","Omnis laborum quos. Consequatur harum modi quo ullam cumque beatae maiores repellat corporis. Est magni accusamus praesentium praesentium nobis et aut eligendi expedita. Sed at et corporis ut ex distinctio eius minus. Expedita voluptas fuga beatae assumenda dolore.","2018-02-21 07:02:77","3"
270,"25","25","5","5","5","5","5","1","At rerum eaque dolores voluptatum placeat omnis. Perferendis sed delectus autem. Officia expedita possimus suscipit ex ducimus. Et esse ab labore est. Nostrum et illo similique sed voluptatem velit. Aut repudiandae tenetur aperiam quas nulla animi. Fuga quia illo eos.

Aspernatur saepe est sit cupiditate libero aut cum. Minima natus sed perspiciatis rerum ea dolorem et. Adipisci et eaque perferendis totam ipsam hic. Aut ea explicabo iure dignissimos quidem quis modi quam. Neque deserunt voluptate maxime similique odit recusandae. Voluptatibus nemo earum aperiam nihil veniam libero. Omnis sint ipsum voluptas facere tempore consequatur.

Harum commodi officiis saepe possimus perspiciatis in fugit quam animi. Occaecati suscipit recusandae eum nostrum. Laborum et modi sit. Ea cumque odio reiciendis accusamus iure.","2018-09-06 08:09:49","5"
271,"41","25","5","5","2","2","5","1","Aliquam quo voluptatem mollitia amet. Quas deleniti deleniti ipsa cumque eligendi modi exercitationem rerum omnis. Expedita rerum placeat voluptatum dolores maxime distinctio non. Dolore totam perspiciatis pariatur repellendus aliquid. Saepe laboriosam sit itaque rerum.

Reprehenderit quia nobis ex natus in rerum non. Et est similique. Occaecati culpa aperiam voluptatem dolorum. Dolore molestias sint minus. Sit et quis voluptas natus laboriosam.

Mollitia magnam consequatur. Dolor ea nisi accusamus repellendus alias laboriosam. Dolore natus asperiores aut perferendis sit culpa. Similique qui veniam possimus ad voluptatem expedita soluta. Esse culpa ut eos quos aut. Mollitia natus autem odit atque.

Ratione aperiam sequi quaerat molestiae. Suscipit temporibus sed veniam exercitationem ea. Ea voluptas est id et fugit est explicabo facere. Aut beatae consectetur unde fuga ipsa iure eaque laudantium.

Facere aut qui magnam sit rerum eligendi dolorum et aliquid. Et iusto omnis aspernatur esse consequatur laborum. Ea aliquam laboriosam magni debitis occaecati qui et eius ipsum. Reiciendis et odit voluptatem aut culpa iste est et. Architecto odit ipsam aspernatur aut. Ullam unde tempora aliquid totam blanditiis et. Atque occaecati blanditiis ex aspernatur similique dolores.","2018-08-29 06:08:33","8"
272,"96","26","3","3","5","5","4","1","Necessitatibus et ratione totam similique qui ipsum. Vero culpa qui ut est laborum dolore. Ut eos rerum consequatur cum et facere voluptatem deleniti quia. Aliquam quaerat ipsa nihil non maiores et dolorem. Velit esse recusandae accusantium perspiciatis. Et perferendis pariatur ea ratione qui.

Recusandae cupiditate exercitationem optio eius cumque corrupti et assumenda harum. Libero ut et. Et sint deleniti labore eos dolore quia. Nemo ut dolore veritatis fugiat id voluptatem.

Sit ab est quas architecto et. Laudantium eos sit inventore. Voluptatem reiciendis reiciendis sunt et. Rerum nemo recusandae.

Expedita voluptatibus dolorum est nobis aut iure minima. Distinctio in sed molestiae doloribus qui qui nemo ratione nostrum. Id fugit maiores nihil.

Ad inventore aperiam tempore perspiciatis officiis atque harum nihil facere. Ad assumenda eum numquam et velit aut error sapiente beatae. Ratione ad cumque ut dolorum mollitia expedita hic corporis sed. Beatae accusantium commodi. Optio fugiat maxime nemo.","2018-07-12 04:07:51","5"
273,"5","26","5","2","5","5","5","1","Sed fuga eum. Occaecati velit provident sed. Qui suscipit voluptatem nesciunt maxime qui iusto accusantium iure. Ipsum eaque porro adipisci est.

Architecto placeat aperiam quo similique atque. Quam quia esse eum ut voluptas. Veritatis quidem ullam iure consequatur eius sequi necessitatibus laboriosam. Dicta quidem ea quas magnam corporis.","2018-07-10 06:07:19","5"
