id,userId,restaurantId,overallRating,foodRating,serviceRating,ambienceRating,valueRating,wyr,text,date,partySize
496,"48","46","5","5","5","5","3","1","Accusantium est nesciunt vel sit enim dolor. Quidem nesciunt sed saepe vel voluptas praesentium sed. Voluptatem nesciunt quisquam et expedita quo. Debitis sed quas molestiae dolores est quia veritatis. Inventore et possimus in esse maiores quisquam quod hic. Deleniti modi pariatur autem. Minus blanditiis qui.

Quia est minima qui possimus quidem. Non iste eum omnis ratione aliquid. In nemo ducimus. Ut sed natus dolor mollitia doloremque facilis.","2018-09-10 08:09:40","7"
497,"97","46","5","4","4","5","5","1","Quos quibusdam magnam vitae laudantium. Placeat illum illum. In dicta eius sapiente possimus. Quibusdam et similique possimus sunt earum. Et quia quasi omnis. Voluptatibus est eos. Cum saepe soluta nam voluptas.

Sint similique id tempora. Error beatae harum.

Vel mollitia reprehenderit iure praesentium iusto eveniet ut fugiat. Ea minima fugit tempora officiis repellat. Vero nulla consequatur maiores possimus. Eum aut consectetur distinctio corporis laborum voluptatem illum sunt veniam. Sunt iure facere quod harum doloremque fuga sint. Ut ipsam voluptatem quaerat.

Sit iure est eius numquam aut non id hic enim. Possimus ratione velit eveniet minus aut suscipit harum autem. Molestiae perspiciatis aut sunt. Fugiat quasi debitis maxime consequatur.

Rerum in omnis quia. Sequi non quis fuga magnam optio.","2018-04-12 03:04:94","7"
498,"17","46","5","3","5","3","5","1","Sit pariatur libero cum assumenda rem nesciunt necessitatibus non. Voluptas omnis eos ut unde dolores omnis vel unde. Ut sed aut quidem a vero omnis id qui consequatur. Maiores autem sint ullam temporibus eaque repellat assumenda. Ullam nesciunt repellendus adipisci sint facere tenetur nulla.

Quae quae nisi. Tempore sit reiciendis voluptas ipsum neque autem. Autem reprehenderit quae assumenda soluta blanditiis accusamus. Earum quo repellendus labore dolores dolorem aut dolores ea. Quia sit velit neque harum enim autem deleniti. Est itaque ut repellat non ut sed maiores ex quia.

Recusandae autem quaerat aut sit rerum explicabo rerum dolore optio. Sed ut dolor voluptatibus ad vero et excepturi. Quo nemo qui porro autem corrupti quo magnam laborum. Sunt eius vitae molestias velit tenetur consequatur. Sed a odio aut sint nostrum repudiandae placeat itaque libero. Omnis blanditiis hic. Molestiae iste amet incidunt.

Dignissimos rerum cum qui dolore labore voluptatibus magnam possimus repellendus. Dignissimos dolorem quae a voluptatum inventore. Sed ut corporis voluptate. Numquam eos omnis velit rerum odit quo impedit iusto.","2018-01-14 22:01:62","6"
499,"4","46","5","5","5","5","5","1","Doloribus ipsa consequatur incidunt tempore doloribus dolor. Veniam est dolores at. Dolorem pariatur et consectetur qui labore voluptas voluptatum. Labore quod veritatis necessitatibus vel. Excepturi tempora labore ab magni harum ut.","2017-10-25 04:10:80","6"
500,"19","46","5","5","5","4","4","1","In et nihil distinctio. Voluptas rerum excepturi. Exercitationem eligendi veniam inventore delectus iste quidem. Qui possimus est facere rerum. Earum consequatur nobis impedit voluptatem.

Optio quibusdam ipsam veniam facere doloremque nemo. Ut corporis aliquid itaque omnis explicabo porro est.

Autem incidunt odio aperiam ut. Est similique nisi quae vero. Voluptatibus vitae et nulla. Sint dolor provident facere dolor voluptate. Dolores cupiditate qui modi rerum est fugiat ullam optio ipsam. Voluptates voluptas similique dolorem vel praesentium recusandae doloremque a. Rerum atque aut voluptatibus itaque placeat assumenda consequatur earum dolorum.

Rem neque veniam voluptas expedita magni mollitia ex quis. Ea et pariatur qui voluptatem quae porro asperiores quisquam. Deserunt quaerat eum qui voluptatem odit rerum quaerat tenetur. Molestias exercitationem aspernatur eligendi. Molestiae ut quae saepe et expedita voluptatem ut. Minima a eius est qui.","2018-03-03 23:03:90","2"
501,"71","47","5","5","5","4","5","1","Aut aut quae est provident autem et velit ullam. Ad et itaque odit aut deleniti possimus sed cupiditate. Quos aut sunt dolor id doloremque quos asperiores at sint.

Sapiente repudiandae repellat. Et non architecto vel esse exercitationem. Quidem optio officiis repellat ut eveniet adipisci officiis.

Nobis aut quos est quae adipisci impedit. Natus ut et deleniti nobis aliquid ut illum ea. Consequuntur deserunt aut. Qui et doloremque. Alias corporis non laboriosam molestiae minus quod.","2018-01-31 23:01:67","3"
502,"96","47","3","3","4","5","4","1","Soluta qui non mollitia quia. Sit non ullam ab et. Illo recusandae sapiente et eos fugiat eum quae qui. Debitis deleniti reiciendis qui. Ut est adipisci officia. Totam et atque dolores occaecati consequatur in. Qui consequatur ut numquam ullam. Velit iure iure soluta distinctio at in.","2018-10-15 10:10:23","5"
503,"18","47","3","4","3","3","5","0","Animi omnis sunt distinctio labore tenetur quae quae quia est. Odio minus corporis nihil. Similique repellendus expedita minima dolores voluptates. Sed incidunt nam voluptas sint placeat nisi doloremque molestiae. Ut et voluptas et dolor omnis dolore consequatur.","2018-06-24 11:06:29","3"
504,"62","47","4","4","5","5","5","1","Et sed vero ut deleniti quia qui. Quae molestiae ex sit ut autem. Non quod ad omnis molestiae.","2018-02-19 22:02:39","4"
505,"87","47","5","5","2","5","5","1","Nulla veritatis dolorem eos quibusdam non et sint. Consequatur ipsa vero. Tempora explicabo velit dolores veritatis et est pariatur quibusdam. Sed earum quidem.

Id totam quam iste voluptatem blanditiis quia vero placeat. Sint laborum quo in consequuntur in quibusdam neque fuga unde. Sapiente deleniti repellat temporibus deserunt rem. Voluptas deleniti quam voluptatem.

Impedit adipisci eos reprehenderit aliquid. Aut dignissimos id. Eaque fugiat ab quisquam voluptatem exercitationem vel. Quo facere earum. Autem quis magnam ducimus mollitia sunt quis. Aliquid quasi alias asperiores. Non velit ipsa consectetur repellat quasi dolor qui tenetur non.

Tempore et voluptatibus. Reprehenderit quibusdam ea animi harum dolores excepturi. Et fugit ea. Voluptates nisi assumenda eligendi ut velit consectetur nisi nesciunt aliquam. Corrupti eius explicabo distinctio voluptatem magni commodi optio est. Harum accusantium voluptatem.","2018-01-03 13:01:75","4"
506,"49","47","5","5","5","4","4","0","Facilis sunt quisquam dignissimos voluptates vel voluptas. Neque eum et aut alias voluptatem quos quis maxime eligendi. Ut ex officiis. Officiis aut officiis architecto placeat similique rerum voluptate adipisci. Id iste omnis.

Incidunt sunt aliquid saepe impedit et tenetur repudiandae quas delectus. Rerum ipsa incidunt temporibus. Qui eos non a earum occaecati nihil voluptatem sequi.

Est ea mollitia molestias sed non. Eveniet eveniet ducimus aut vel in deleniti. Asperiores ipsum ipsa ratione aut ut mollitia dolores. Odit quidem voluptatum maxime laborum et minus molestiae. Qui natus sunt perferendis voluptatem.

Nihil temporibus dolores quam adipisci dolorum eos. Illum nulla voluptatem dolor. Aut ad eaque eius. Et eius ea.","2018-09-03 01:09:42","8"
507,"97","47","3","5","5","5","5","1","Quia aut iure. Assumenda sequi natus ut dolorem commodi. Aut dolores et omnis quisquam explicabo. Est mollitia perspiciatis pariatur repellendus et fuga repellat temporibus quam. Autem debitis ut asperiores voluptatem.

Aspernatur atque voluptate dolores odit fugiat similique repellat. Vero tenetur doloremque nobis at autem blanditiis sit. Omnis ut omnis enim. Architecto et fugit laborum nam impedit animi ratione. Nam velit necessitatibus ratione ea libero qui sunt. Quas ut sunt repellat. Enim eius aut aut ut.

Saepe nisi dicta est ut neque cupiditate rerum. Dolorem quis earum iure at dignissimos. Ea vel nihil eum est fugiat tenetur laboriosam iusto quis. Aliquid est vero ea ut dolores doloribus ut ea corporis. Beatae officia ducimus magnam culpa. Distinctio culpa exercitationem.","2018-02-17 23:02:09","5"
508,"61","47","4","5","5","5","5","0","Totam voluptatem iste adipisci fugit et. Quidem ut ex voluptate alias a dolores qui. Est ipsam voluptas consectetur commodi et quod. Eum aut velit non mollitia. Eveniet sed et sint enim nemo. Sit et ut officiis voluptatem ratione aut nostrum. Aut voluptatem commodi quo nobis aut impedit amet illum. Neque magnam deleniti aperiam inventore dolorem cupiditate voluptatum.

Qui est in maxime. Nesciunt sed qui voluptatem. Eum rerum eos delectus et fugit quo. Saepe fugiat quasi rerum sed vitae dolor. Similique ut itaque magni excepturi explicabo architecto aliquam quos. Aut fugit sed expedita iure et.

Non eos fugiat fugit. Quibusdam blanditiis modi veritatis. Autem tenetur non error ut voluptatem vel laudantium veritatis.","2018-03-10 19:03:48","5"
509,"50","47","3","5","5","5","4","1","Tempora eius et. Vero facilis est vel voluptatem. Est ipsam in quis est sint aut est. Quos eum facilis et necessitatibus voluptas adipisci veniam officia. Qui dicta eveniet culpa rem aut et. Et aut quis temporibus quia et inventore et provident.","2017-10-08 21:10:35","5"
510,"12","47","4","5","5","4","5","0","Minima numquam possimus delectus. Assumenda nihil eum vel autem. Sed atque sit sunt ut. Dicta nihil et fugiat. Quis id adipisci culpa enim nostrum.

Exercitationem dolorem accusantium minus sit aut illo. Placeat blanditiis voluptatum animi commodi ipsum quam. Voluptas atque sint qui cum labore excepturi. Nihil sit vel alias rerum sit consequatur. Et est accusantium quibusdam provident. Ut quia praesentium delectus consequuntur harum et iusto voluptatibus.

Voluptatem sit corrupti laboriosam voluptatem eum ipsam commodi. Ea soluta expedita nihil in reiciendis eum suscipit voluptatibus architecto. Sit blanditiis explicabo minima molestias voluptates veritatis neque. Nihil iste et quam ipsum et doloremque exercitationem aut. Ea velit est et fugiat voluptate fugiat voluptatem.

Ipsum et laudantium ducimus voluptas. Expedita et excepturi sapiente ab qui recusandae. Aspernatur ut dolor unde aliquam molestias tempora.","2018-04-18 05:04:02","3"
511,"38","47","2","5","4","5","5","1","Tempora est dicta autem consequatur ut ab. Illum occaecati dolorum non. Impedit tempore praesentium. Beatae impedit eveniet debitis dolorum quia dolor odio. Et molestiae excepturi tenetur voluptatibus qui. Rerum corrupti fugiat doloremque.

Placeat tempora id officia dolore cupiditate natus et. Eius mollitia in neque. Aliquid voluptas ex ex laborum perspiciatis.

Ullam quas exercitationem voluptatem ut molestiae dolore. Eveniet distinctio vel quo vel. Molestiae autem assumenda iste et. Et et voluptas nulla nihil. Quia quia aut odio quia laudantium.

Qui asperiores qui itaque rerum sit. Debitis magni et eum possimus enim nostrum. Nobis accusantium exercitationem qui maiores veniam saepe. Doloremque voluptate ut dolores quibusdam culpa. Quas sapiente modi commodi neque autem repellat recusandae incidunt veniam. Itaque quasi magnam maxime veritatis sint. Ratione accusantium praesentium.","2018-11-06 07:11:63","2"
512,"36","48","5","5","2","5","5","1","Architecto fugit veniam exercitationem quia corrupti esse. Explicabo ad architecto laborum rerum at quisquam incidunt omnis. Vitae minus et iste suscipit expedita. Repellat odit nihil in et magni et nisi inventore tempora. Enim esse aliquid illo sapiente. Aut voluptas hic ipsum aliquam et doloribus vel ut et. Rerum nostrum nostrum aut asperiores dolorem dolores. Reiciendis libero accusamus voluptate placeat eos accusantium molestiae voluptates.

Rerum totam earum labore non. Molestiae qui facere facilis iste tempora. Exercitationem qui reprehenderit consequatur velit fuga nam nam. Et vel dignissimos qui amet omnis a aut esse. Accusamus inventore magnam aut.

Non reiciendis qui ut non aut nam fugiat. Aut qui enim distinctio nobis. Ut fuga voluptatum. Officia cum sunt amet cumque dolorem. Aliquid aut id velit et assumenda sit.","2018-06-28 22:06:37","3"
513,"95","48","5","4","3","4","5","1","Repellendus placeat sint nam consequatur incidunt vel quo. Fugiat provident ab. Corporis rerum tempora voluptas et delectus laudantium. Dolor eaque enim ut esse doloribus officia est. Omnis similique temporibus provident. Consequuntur earum ut sint optio.

Qui et officiis doloribus sed doloremque. Aut aut necessitatibus repudiandae veritatis rem molestiae. Eligendi dolorem tenetur ipsa quae est reprehenderit accusamus vitae. Non sapiente vitae eius nam ut aut.

Reprehenderit qui vel hic officia incidunt voluptas culpa amet. Rerum velit eligendi voluptates rerum.

Consequatur ut adipisci placeat nesciunt cumque ex non. Exercitationem autem ut voluptate et eos aut architecto impedit. Qui cumque voluptas dignissimos magnam neque. Perspiciatis reiciendis itaque dolorem voluptatem repellat et nostrum. Et quidem autem dolore fugiat nostrum quaerat reprehenderit impedit.

Est qui ut quia quam illo explicabo facilis. Impedit atque molestiae nulla. Perferendis ut quam. Rem enim voluptatem laborum et nemo autem sequi. Accusantium fugiat dicta dolorum architecto est corporis cumque blanditiis magnam. Enim aut et voluptatem nihil velit sunt maiores eius ipsum.","2018-07-12 13:07:70","8"
514,"75","48","4","4","5","5","1","1","Nisi iusto consequatur omnis. Aut numquam itaque vitae quis officia quasi. Non et in iusto libero tempora temporibus repellat. Tempore molestias et. Dolores aut non aut. Reiciendis rerum voluptatibus.

Et quia quaerat. Magnam fugiat modi voluptas consequuntur modi blanditiis ab omnis fugit. Velit non numquam doloremque suscipit iure.","2018-01-26 04:01:26","8"
515,"98","48","2","5","5","4","5","0","Ut perspiciatis a ullam alias voluptatem perspiciatis voluptatem enim. Voluptates maxime dolorem nulla. Earum recusandae voluptatem nisi animi cupiditate quis a.

Eum laborum vel vel officia facere molestiae dolorem facilis molestiae. Deleniti labore eos et.

Fuga non eveniet sit dolor. Blanditiis sapiente dolore voluptatem beatae quia. Quis ipsa qui delectus porro facere architecto omnis delectus. Cumque molestias eius maiores nemo.

Officia et debitis quos est ut assumenda. Recusandae magnam at ut delectus nulla maxime ratione et dolores. Fugit rem et eius praesentium quos cumque. Qui dolore repellat magnam consequatur voluptatem impedit voluptatem neque. Facere id mollitia aliquid repudiandae saepe dolorem ea.","2018-02-16 10:02:23","5"
516,"53","48","5","4","5","4","4","1","Qui dolor enim hic fugit et. Quos vero perspiciatis perferendis et ut quae aut magnam animi. Quis dolorum totam. Repellat nemo necessitatibus ipsum tempora et vitae dolor. Quia omnis qui excepturi hic repudiandae laborum voluptas ratione quae. Nulla aperiam voluptates voluptate doloribus inventore iure qui consequuntur facere.

Ut qui at est ipsam harum animi iure consequatur. Sint magnam et sequi eos. Impedit ullam est in voluptatem nisi molestiae eaque. Animi omnis illo quia velit blanditiis repellendus inventore voluptatem ut. Rerum ea vero vero laborum ut minus. Eos ipsum alias commodi mollitia. Voluptatibus minus quidem tempora molestiae. Qui id aperiam qui.

Cupiditate voluptas ut possimus voluptatem accusantium voluptas. Quia eius necessitatibus quis est aliquid culpa rem. Cupiditate omnis debitis quos et quasi atque odio. Excepturi maxime qui.

Pariatur repellendus quo eveniet aut illo quidem ut quisquam. Necessitatibus neque vel. At omnis architecto dolorem sapiente natus expedita neque mollitia voluptatum. Corrupti recusandae explicabo saepe. Aut illum tempora veritatis debitis quibusdam dolore. Eum optio vel provident nulla nisi. Quo vitae eveniet ut impedit tenetur.","2018-07-04 10:07:13","2"
517,"48","48","3","4","4","4","4","0","Molestiae voluptatum alias. Architecto temporibus provident dolorem sit nostrum molestiae quidem omnis doloribus. Cumque aut dolores esse modi. Voluptatibus non vel aperiam blanditiis nesciunt quos pariatur quas est. Non similique qui similique architecto dolore rerum maiores repellat quae. Dolores iusto cumque omnis animi qui et sunt voluptatem quas.

Aut deleniti voluptas aut. Est qui odio voluptas distinctio. Id et dolores provident ut porro eum omnis. Occaecati aliquid id quo. Ea ipsum quis sequi illum consequatur similique sit.

Quidem quia suscipit sed ab ut minus voluptatem. Sed molestias voluptas quas vel voluptas eaque consequuntur temporibus culpa.","2018-09-15 21:09:04","2"
518,"64","48","4","2","4","3","5","1","Vitae autem eaque ut doloribus molestiae qui qui. Reiciendis magni dolore dolores et corrupti libero aperiam qui. Omnis voluptatum non rerum labore vitae excepturi nesciunt. Officiis ipsam aliquam perspiciatis. Corrupti velit rerum.

Officia ut est ipsa. Inventore vero labore consectetur qui molestiae. Tempore veritatis quisquam repudiandae suscipit alias et ea esse. Excepturi eum repellat dolores voluptas aut amet tempora omnis autem. Et eos accusamus occaecati excepturi rerum magni. Error quia animi magnam et aspernatur vitae ut laboriosam dolores. Aut numquam aut sapiente sed deleniti et itaque. Atque vero aut nulla in reprehenderit eligendi quo.","2017-11-05 17:11:48","7"
519,"14","48","5","5","5","4","1","1","Reprehenderit natus quia eum et possimus aliquam. Et rem et qui ut repellendus non. Eveniet tenetur doloribus qui ex velit aut dolor architecto enim. Et sint nulla possimus omnis laboriosam velit. Pariatur quia ut quaerat ratione culpa.","2017-11-22 13:11:84","3"
520,"100","48","5","5","5","5","5","1","Qui quis et doloremque cumque soluta suscipit. Possimus dolorem quia in dolorem et cumque. Quo saepe nesciunt. Possimus commodi consequuntur atque cumque modi nobis. Aut rem magnam quia molestias dolorem. Dolorum temporibus in porro sit.","2018-10-25 22:10:18","3"
521,"53","48","5","5","5","4","4","1","In enim accusamus voluptas ut doloribus. At eum consequatur. Quia et magnam. Nesciunt iure facilis deserunt cum quo autem. Qui cum ex qui placeat est cumque. Impedit sint tempore omnis et blanditiis beatae adipisci.

Libero culpa vel. Vel reiciendis harum. Quia doloremque id earum enim non culpa ut sed. Enim et delectus numquam ea.","2018-04-24 08:04:19","8"
522,"71","49","5","4","2","5","4","1","Consequuntur enim itaque. Natus non illo accusamus. Possimus laboriosam commodi voluptatum nesciunt fugit consectetur voluptatem consectetur. Soluta id similique sunt autem fuga. Facere aliquam et consequuntur omnis esse est et qui sed.

Enim est veritatis velit qui minima. Animi quod velit nulla magnam. Ipsam minus voluptate omnis expedita voluptate. Repudiandae ex expedita.

Quis quo illum reprehenderit sunt ipsa voluptatem et officiis. Maxime odio non et magnam pariatur quia eos. Asperiores porro est earum et enim fugit dicta architecto et. Non quo laborum magnam tenetur quo non. Voluptatum porro at corrupti in earum optio et officia. Nemo quia aliquam asperiores eum earum est.

Maxime magnam sed qui enim nemo vel voluptatem ipsa. A et et aspernatur. Itaque ut quisquam eaque vitae et. Eos quia esse odit dolore.","2018-07-09 03:07:77","6"
523,"52","49","5","2","5","5","5","1","Harum nihil repudiandae quia corrupti. Voluptas similique nam voluptatem. Et ut ea consequatur blanditiis aut consectetur et dicta repudiandae. Atque sequi corrupti.

Et in doloremque eum atque ex sit. Officia ea et voluptatem nihil neque voluptatem culpa ut dolor. Cupiditate neque esse voluptatibus dolor. Sed et quia quia ut voluptate est molestias suscipit consequatur. Magni consequatur est et eos doloremque. Est recusandae nihil laboriosam voluptatem ab repellat impedit dignissimos sit. Suscipit numquam qui qui rerum nihil ducimus earum voluptatem. Omnis adipisci praesentium et praesentium quia eum voluptatem libero.

Neque repudiandae dolore rerum omnis vero enim voluptatem qui. Quam similique nisi laboriosam quis vel maxime. Sed dignissimos tenetur aut veniam exercitationem perspiciatis quia quia dolorem. Deleniti praesentium provident et unde ut dolorem debitis odit quibusdam. Error suscipit debitis. Recusandae ut voluptas et ullam laborum autem quis ut.

Deleniti ullam pariatur voluptatibus blanditiis dolorum et. Inventore repudiandae earum quidem perferendis. Temporibus dicta tempora velit ut autem. Ducimus nemo magni.

Ut ut voluptatibus voluptate tempore. A tenetur quidem blanditiis quia dolores officiis dolorem. Et et qui modi suscipit et dolores corrupti neque expedita. Odio quasi minima totam. Voluptatem et nostrum quibusdam ad. Cumque error aut necessitatibus.","2017-10-17 12:10:62","5"
524,"62","49","4","3","4","5","5","1","Deserunt qui non repellendus consequatur recusandae enim illo voluptatem velit. Explicabo et est aut. Id porro qui doloremque suscipit minus et. Excepturi sed provident error mollitia facere. Sunt temporibus rerum pariatur voluptas ut sed est corporis quibusdam. Non in voluptates deleniti quaerat.

Consequatur natus assumenda animi voluptas dolorum omnis enim itaque fuga. Sunt accusantium est. Porro aut quam temporibus et magni laboriosam ullam ut et. Nobis id eaque et est. Esse provident sed aliquam ullam qui. Sint adipisci quia culpa beatae aut iusto molestias qui quia. Impedit commodi impedit. Ullam incidunt in et qui.

At est sunt. Quia saepe cupiditate vitae cumque.

Eveniet quaerat praesentium eum eius dolor. Quas magni non aliquid aut deleniti est vel dolor. Quod provident temporibus. Aut et quod corrupti vero sed aut ut.","2018-09-28 23:09:21","6"
525,"22","49","5","4","5","4","4","1","Dolor similique non harum et porro doloribus quo nobis. Aut eveniet alias nesciunt esse distinctio minus itaque.

Nihil pariatur sit at. Temporibus illum qui ducimus nostrum delectus est nam. Maxime ab sint sunt.","2018-10-01 04:10:46","7"
526,"16","49","5","5","5","4","5","1","Voluptas accusamus rerum ea provident. Eaque dicta nostrum blanditiis minima. Voluptas quia placeat nesciunt et in. Voluptate omnis animi quibusdam. Aspernatur nam est. Est qui sint quisquam modi similique. Voluptatem aut qui.

Omnis tempore aliquam voluptatem in quia modi quia non. Nam nulla illum fugit nihil. Optio voluptatem reprehenderit nam itaque sit dolores illum exercitationem vitae. Ad et sed mollitia provident quas voluptatem omnis officiis odit. Consequatur accusamus voluptatem consequatur impedit voluptatem cumque. Reprehenderit commodi et enim qui recusandae facilis.

Aut optio vel eligendi et sed quae assumenda nisi. Sint eaque quasi quaerat tempore aut facere ea fugit. Recusandae quisquam numquam cum. Et molestiae quis assumenda enim sunt totam. Aut labore tempora et. Nam quisquam possimus praesentium sit quia id molestiae atque.

Architecto eos a eveniet aut repellendus. Omnis voluptatem exercitationem blanditiis dolores nemo. Excepturi et id corporis provident voluptatem asperiores neque. Vel dolore saepe totam aut. Odio consequuntur autem blanditiis recusandae non harum eum sunt labore.","2018-07-23 02:07:87","3"
527,"5","50","5","4","4","5","5","1","Impedit est dolorem atque molestias adipisci. Nesciunt sint ipsam adipisci. Occaecati fugiat quod aut nulla id vero. Deserunt aspernatur ullam optio est laudantium soluta. Aspernatur ut dicta sint in vitae est voluptatem. Nam aliquid sunt ducimus quia velit laudantium possimus praesentium. At non delectus nihil consectetur vel sint in.","2018-08-22 00:08:10","7"
528,"86","50","4","2","4","4","5","0","Velit consequatur molestiae ut quia optio dolore quos nemo. Adipisci natus fuga voluptas ipsam et et cupiditate. Eos iste placeat porro pariatur. Consectetur nobis minima et. Aspernatur reprehenderit tenetur commodi totam. Perspiciatis quia qui maiores in quis et fugit. Sit delectus molestias voluptatem et. Non fugiat amet velit facere rerum sunt eos incidunt illum.

Enim fugit sunt. Soluta id rem illo molestias laudantium aperiam quam ea minima. Laborum ea vitae dolorem. Et voluptatem deserunt. Est sed aspernatur earum blanditiis aliquid eos deserunt ut. Tempora voluptatem reprehenderit. Cumque optio voluptatum sunt quaerat aut facilis dolor quaerat.

Et totam doloremque neque animi. Sit et sint hic repudiandae laudantium necessitatibus velit iure atque. Possimus veniam sint aut ipsa molestias occaecati. Facere illum nemo quo rem in. Porro iure id deleniti excepturi aliquam eveniet. Et delectus ut sunt quas voluptas minima. Consequatur voluptatibus illum porro quisquam repudiandae similique et in.

Provident non inventore eaque est fugiat vel ut voluptatibus est. Non nobis nam et veritatis voluptatem tempore vitae dignissimos inventore. Soluta reiciendis et necessitatibus totam quia eligendi. Velit molestiae tenetur qui fugit sit repudiandae ea. Omnis reprehenderit quia cumque eum non. Libero accusamus numquam sint fugit impedit. Qui quibusdam unde quod qui cupiditate nemo velit. Esse est minus maiores aut aspernatur corporis ex eum.

Ut inventore eaque quae ex illum et vitae sint nihil. Amet non omnis aspernatur quia omnis quo. Autem quo nemo deleniti officiis molestiae laborum. Odio deleniti nostrum.","2017-11-24 23:11:83","3"
529,"11","50","5","5","5","4","4","0","Quidem et porro occaecati quia accusantium quasi voluptatum minus. Vitae non cumque consequatur autem et non doloremque. Assumenda reiciendis fugiat quasi molestias accusamus et minima quia. Dolorum sapiente sapiente sed debitis sunt. In soluta quae ex aliquam. Rerum perferendis ea accusamus similique harum eius ut et. Deserunt doloribus neque doloremque delectus et in. Voluptas praesentium unde eius repellat officia.","2017-10-05 17:10:97","2"
530,"45","50","5","5","5","5","2","1","Qui voluptatem molestias impedit deleniti nam. Ullam non voluptatibus harum qui labore. Qui ad quos et eum doloremque dolorem. Enim veritatis nisi. Dolorem laudantium ducimus eligendi reiciendis iure error. Eos neque iusto.

Ut hic modi atque tempore qui. Tenetur et incidunt expedita repellendus et qui omnis et. Quia minima eos expedita.","2017-11-08 23:11:82","4"
