id,userId,restaurantId,overallRating,foodRating,serviceRating,ambienceRating,valueRating,wyr,text,date,partySize
738,"65","72","5","5","5","5","5","1","Autem fugiat voluptas maiores totam qui minima. Qui perspiciatis amet modi cum ea nisi sint animi. Itaque dolore quis non illo. Eos et consequuntur explicabo sed modi alias rerum. Qui pariatur provident consequatur accusantium optio modi incidunt. Quibusdam veritatis aliquam repudiandae quis tempore nobis.

Et iure rerum consequatur at autem rem voluptatibus. Ipsam aperiam molestiae consequuntur saepe sapiente. Aliquam vero voluptatibus at porro.

In saepe voluptate exercitationem sit saepe voluptatem et et eos. Optio nam error excepturi pariatur ut ut quaerat. Illum quis eius modi voluptate eligendi non est perspiciatis dignissimos. Autem harum iusto et nesciunt ex enim et enim. Eius suscipit et assumenda explicabo et cum blanditiis natus cum. Incidunt ut perspiciatis consectetur odio.

Omnis eos culpa temporibus vitae odit voluptatem. Accusamus esse earum dolorem doloribus eligendi nobis consequatur illum. Odio saepe nobis doloribus laudantium tempora maiores. Nostrum voluptas doloremque eum expedita laborum. Rem doloremque aut accusamus ea facilis ab corrupti. Laboriosam placeat incidunt temporibus enim recusandae aliquid quia delectus.","2018-06-08 06:06:67","4"
739,"35","72","4","5","5","5","3","0","Cum officiis deserunt fugit vitae distinctio velit. Corporis illum aut incidunt. Quia eos odio exercitationem quaerat molestiae vel. Illo et corporis accusamus totam similique. Aliquid sit facilis veniam. Corporis voluptate illum eos ipsum ut mollitia. Quasi nobis enim dolor ducimus.","2017-12-19 11:12:29","2"
740,"72","73","5","5","5","5","4","1","Corrupti qui natus dolorum quos. Illo reprehenderit dolorem quia vero incidunt architecto facilis tempore commodi. Dolore ipsam omnis blanditiis pariatur. Et provident et et aperiam est. Rem quibusdam iure et praesentium nemo odit voluptatem tempore repudiandae. Nam et soluta assumenda aut accusantium. Sunt rerum eos facere est cum enim ut.

Id quod facere tempore est iure quis aut beatae autem. Quam laudantium in. Odio sit dolorem eius ut.

Tempore non facilis sed explicabo. Molestiae eligendi quos. Quam assumenda eligendi. Aliquid laborum eum. In autem iure numquam ab est vitae ea.

Quia expedita sit et dolor animi saepe eligendi. Eos dignissimos ipsum non velit ipsum voluptas. Dolor labore inventore soluta rerum maxime sed eveniet omnis. Tempora et voluptatibus ipsa omnis qui alias.

Nam adipisci repellendus laboriosam et. Ut voluptate a fuga modi delectus voluptate est dolor consequatur. Deleniti non non.","2018-09-04 07:09:33","2"
741,"95","73","5","5","5","4","5","1","Non eaque nihil quo. Repellendus beatae suscipit unde animi. Eum corporis porro. Recusandae magnam aut doloremque velit neque repellat non et ea. Eveniet reprehenderit quia autem et nesciunt delectus ullam nisi id. Ut quasi eum qui rem odit est veniam accusamus. Ea nihil quis modi.","2018-04-03 18:04:48","2"
742,"93","73","5","5","5","5","5","0","Aspernatur sunt architecto qui nam dignissimos. Magnam at perferendis aspernatur qui et ut impedit.

Ullam quibusdam nisi odit a. Sit veniam est. Cumque dolor ullam tempore eius. Quisquam alias iste ipsam culpa eveniet. Dolorum neque alias facere.

Autem voluptas et praesentium sit. Et voluptatem iure. Adipisci vel qui dignissimos magni. Sunt quia mollitia aut et dolores enim neque. Cum quod quia dignissimos recusandae sapiente ut. Dignissimos in voluptas similique cupiditate.

Consequuntur voluptatem nisi labore. Non maxime quisquam rerum odio accusamus. Unde dolorem temporibus itaque minus sint. Pariatur omnis et dolorem corrupti at repellat ratione facere. Nisi reprehenderit quas voluptas ex impedit quae id.","2018-02-03 21:02:94","3"
743,"5","73","4","5","5","5","5","0","Ut est quod est nulla voluptas dicta. Omnis et doloribus magni ea molestiae magnam. Dolores enim qui modi. Qui magnam magni. A earum provident animi totam dolorem reprehenderit provident. Aut incidunt qui expedita aut non a quam eos.

Officiis eos vero dolores velit. Illo debitis incidunt voluptas sint atque rerum eos cum. Ipsam voluptatem perspiciatis ipsum exercitationem omnis et.","2018-04-04 00:04:15","2"
744,"55","73","4","2","5","4","3","1","Commodi quam aut ut quibusdam deleniti sit perspiciatis sint fugiat. Est earum sapiente vel a non provident animi autem. Tenetur sint quod dolor. Occaecati quia eos doloribus ab est cupiditate corporis error. Magni eligendi commodi. Natus tempora et quis assumenda quia alias dolorem. Assumenda dicta delectus vitae quia cum est ducimus.

Ex illum voluptas quis quasi sed nisi cumque voluptate. Et ea in. Sint quod aut nobis eos perferendis at perspiciatis aut repellendus. Nulla vero sapiente consequatur id sed. Quos nam tempora odio hic et.","2018-08-31 00:08:56","5"
745,"73","74","5","3","5","5","3","1","Sint qui aut quod voluptatibus sit doloremque officia temporibus vel. Laudantium nihil suscipit voluptatum fugit ab rerum alias dolorem. Fugit quas voluptas aut atque sunt fuga magni. Reiciendis incidunt architecto deleniti voluptate et voluptatem.","2018-07-16 04:07:82","4"
746,"17","74","4","5","2","5","4","1","Enim quaerat porro quisquam in earum dolores dolorem aut. Et placeat ea et repellat ea quos vel dolores vitae. Sit nisi aliquam. Quia sequi qui impedit quia unde tempora. Et sunt dolorum voluptatem id esse distinctio qui aliquid. Beatae corrupti quas. Quia temporibus sed molestias rerum labore voluptate id id.

Deserunt eos consequuntur velit. Et et aut. Vel rerum sit optio nam quisquam dolorem. Nulla ab at voluptas et omnis accusamus quas vero aut. Omnis animi soluta sed maiores.

Quos est at consectetur molestias et. Veritatis occaecati sed ullam nostrum. Sunt ut in tempore et dolores explicabo quas facilis atque. Sint aut laborum excepturi sint fuga corrupti reprehenderit. Voluptatem qui saepe eum incidunt autem quibusdam. Rem et est aliquam mollitia cumque. Tempora neque sunt perferendis tempora sunt est dolor.","2018-01-15 11:01:49","2"
747,"72","74","5","5","5","5","5","1","Non officiis itaque sit dolores est sapiente temporibus optio animi. Neque qui et ut nihil.

Accusantium quae incidunt aut eligendi corporis natus. Laudantium dignissimos autem saepe. Fugiat tempore deserunt autem possimus deserunt voluptatem repellendus. Optio debitis dicta repellendus nesciunt temporibus consequuntur sit et veritatis. Dolores voluptatem at. Similique animi amet.

Vitae et eos voluptatem beatae repudiandae. Cumque odio aut quibusdam velit voluptate modi voluptatem. Labore sunt et ipsam nisi non. Vel ut autem ea similique vero vero. Amet cumque itaque nemo tempore. Eius dolorum et fuga voluptatem aut et omnis.","2018-03-16 23:03:33","8"
748,"46","74","3","1","4","4","5","1","Excepturi ratione deserunt corrupti ut ad. Velit fugit et sed sed et. Aut quo quam ut eligendi error accusamus et quia dignissimos. Enim nemo et voluptatum deserunt esse quasi omnis debitis accusamus. Iste omnis et blanditiis dolorum aspernatur voluptatem.

Quis harum et fuga minus et consequatur asperiores incidunt. Ullam eligendi harum. Fugiat maiores optio dolorem. Possimus impedit numquam non est officiis et exercitationem exercitationem asperiores.

Voluptatum consequatur qui rerum perferendis voluptatem dolor consequatur asperiores. Aperiam odit atque quia esse aperiam sint eveniet quis. Corporis expedita nulla sed. Sunt velit voluptas commodi esse numquam explicabo. Iusto quia maxime vel adipisci odit.

Officia nihil excepturi. Debitis non ducimus praesentium consequatur vel ipsum veniam amet nulla. Qui similique rerum. Ut earum nobis enim facere accusamus cupiditate et suscipit. Nesciunt suscipit asperiores debitis consequatur magni. Iusto officiis sunt doloribus magnam ipsa assumenda.

Praesentium nemo et enim ipsam. Eum consequatur velit numquam qui quis laborum. Quo ut aut beatae. Laudantium rerum et et deleniti. Et a molestias et unde aut ut quasi recusandae.","2018-07-24 11:07:49","4"
749,"71","74","5","3","5","1","5","1","Officia similique asperiores porro. Aut ratione consequatur dolorem deleniti hic. Maiores dolores eius nesciunt temporibus qui id reiciendis iusto nisi.

In est quasi. Et eum qui ex molestiae est ea. Saepe fugit voluptas qui aut exercitationem architecto facere. Deleniti deleniti tempore provident sunt magnam ab molestiae. Corporis accusantium officiis deserunt.","2018-01-05 04:01:98","2"
750,"74","74","4","4","2","5","4","1","Ipsum consequatur fuga sed occaecati magni veritatis ut exercitationem quo. Laudantium incidunt quibusdam odio est dolorem. Temporibus aut non ipsa officiis aut et harum. Aliquid quia natus voluptatibus nam eum qui sed.","2018-10-19 13:10:33","7"
751,"74","74","5","4","5","5","4","1","Est voluptas et et recusandae sit ratione aliquid. Consequatur odio corporis quia vitae ea ad consequatur sit commodi. Ut non facere dicta molestias. Esse ipsa iste eius eos aperiam ducimus perferendis adipisci voluptas. Iure ducimus rerum aut perferendis dolor.

Sint deserunt assumenda reprehenderit exercitationem excepturi quia. Voluptas quibusdam ut quia tempora dignissimos et hic. Alias omnis illum sunt soluta. Dolore eveniet voluptatem sit. Consequuntur et expedita sint reiciendis commodi dolorem molestiae labore.

Perferendis et quod quia qui quibusdam velit. Quibusdam voluptatem illum facilis vel et. Error odit illo eos qui alias sint quo est et. Architecto modi dolorem dolorem aperiam rerum repudiandae. Est aut rerum sed totam.

Ut facere dolore eos ut. Maxime autem autem repudiandae excepturi. Sit non voluptatum maiores molestiae.

Soluta molestiae est totam temporibus asperiores. Inventore dolor sed libero laboriosam aut eos odio dolorum deleniti. Totam at eaque non ipsam sunt neque voluptatem in. Ut aut animi architecto voluptatem neque. Repellendus sint et exercitationem aut nulla. Repellat qui porro voluptas asperiores aliquid magni illo et laboriosam. Non mollitia sint veritatis molestiae dicta. Est voluptate veritatis consequatur voluptas.","2018-06-15 20:06:22","3"
752,"4","75","5","5","5","4","5","1","Officia quia quia vitae. Velit omnis voluptates. Ut et quidem deserunt nobis. Modi aut ea.","2017-12-07 20:12:82","2"
753,"93","75","3","3","5","5","4","1","Eos sed adipisci commodi pariatur culpa. Suscipit sunt eos repellendus. Eaque quia ipsam consequatur quibusdam quasi dolore.

Qui magnam placeat enim unde consequuntur dolorum. Quae sed sit quisquam nisi laborum. Iusto quis repellendus asperiores. Ullam dolorem dolores ipsam. Ex similique velit consequatur. A magnam quod in.","2017-11-24 18:11:67","6"
754,"48","75","5","3","1","2","5","1","Quisquam sint iure doloribus quia est similique. Nesciunt quia voluptatem dignissimos sit aut porro corrupti. Cupiditate veritatis consectetur odit quae ut nam rerum. Aliquid itaque sed deserunt illo dignissimos quo fuga.

Magnam suscipit doloremque itaque laborum et nesciunt eveniet. Nostrum tempora veritatis nesciunt. Accusantium qui eos quia quod voluptates veniam fugit fugit.

Est qui vel et explicabo quia sit cum pariatur. Aut molestiae laborum nam nesciunt error. Enim expedita labore velit labore aliquam assumenda. Sapiente consectetur quibusdam. Cum veniam quibusdam consequatur quibusdam rerum maxime impedit ipsum necessitatibus.

Veniam modi dolorem dignissimos. Suscipit sit eos iure nisi quia. Eaque perspiciatis sint et tempore consequuntur non culpa.

Illo id distinctio et soluta eos. Voluptas debitis ipsam distinctio voluptatum odio assumenda dolor. Enim aliquid similique. Doloremque sed architecto et alias laboriosam nemo. Consequuntur dolores expedita. Eum excepturi ratione quo dolores dolorem.","2018-10-21 04:10:98","7"
755,"64","75","5","5","5","5","4","0","Fuga aperiam veniam beatae saepe omnis minima et molestiae tempore. Cum perspiciatis id error culpa sit in quia. Adipisci sit veniam et. Est nesciunt esse aliquam aut est.

Laboriosam inventore et perferendis. Eos cumque vel rerum fuga omnis error tempore iure quas.

Aliquid quaerat aliquid inventore quo ut. Nemo hic omnis. Et quia dignissimos qui omnis deleniti velit porro accusamus. Iusto rem beatae mollitia ab molestiae non suscipit quia.","2018-08-08 06:08:80","2"
756,"83","75","5","5","5","4","3","1","Molestias doloremque quos. Eum qui ut quo inventore fugiat doloremque aspernatur sit. Occaecati ut veritatis expedita consequuntur iusto non. Veniam ut mollitia quia totam.

Odio omnis qui minima doloribus omnis omnis quidem dignissimos aliquid. Ipsa ipsam non dicta exercitationem suscipit. Ducimus dignissimos esse ex amet expedita quia. Qui non quis sint voluptatem nesciunt est. Corrupti sed velit beatae blanditiis qui et error soluta voluptatem. Unde facere quaerat eum non aut.

Dolor eaque iusto molestias eos. Illum quibusdam praesentium rerum cumque voluptatem quos. Similique quia nostrum laboriosam iusto dolorem voluptatem provident. Sit aliquam qui blanditiis omnis beatae. Quibusdam minus ut est odit et aut enim. Qui ut quia dolorem est aut et quae.","2018-09-24 02:09:63","7"
757,"85","75","5","5","5","4","3","1","Est id provident et minus quo sint. Est eaque voluptas quis recusandae nemo sit. Molestiae sint repellat nemo. Earum totam unde. Dolor culpa ratione laudantium id a.

Reiciendis voluptatem fugit perspiciatis vel ut officiis et tenetur eum. Voluptatem architecto quis. Adipisci impedit sunt magnam qui. Porro a odio consectetur aliquid voluptatum et reiciendis magni adipisci.","2018-07-29 19:07:59","7"
758,"51","75","5","4","2","4","3","0","Similique aut voluptatibus officia. Voluptatem accusantium neque tempore quibusdam earum ipsum officia reiciendis. Suscipit et voluptas fugit aliquam quis reiciendis quibusdam exercitationem. Quidem facilis sed ullam inventore rem aut dolores soluta consequuntur. Accusamus autem ut ut odio incidunt quo ut repellendus.

Ex aut at placeat quaerat quae. Consequatur accusantium aliquid ullam veniam officia. Aut distinctio aliquam enim sapiente distinctio quos dignissimos. Voluptas optio modi natus iste provident et.","2018-02-16 04:02:36","7"
759,"61","75","5","5","5","5","5","1","Temporibus fuga optio esse id. Aut modi delectus et eos tempore aut. Necessitatibus veritatis nam sunt omnis quas maxime velit delectus autem.

Cumque quis numquam ut dicta in ad quia praesentium. Rerum ut reprehenderit voluptas error labore doloribus in. Consequatur repellendus illo vel sed vero sint vitae perferendis. Aut enim magnam non quia. Ut dolore perspiciatis laborum rerum quia.","2018-01-19 17:01:80","3"
760,"17","75","3","4","5","5","5","1","Qui explicabo ut porro tempora accusamus soluta ut. Ut alias est quis qui sunt. Asperiores sit neque esse sed voluptate fugiat nobis. Harum laboriosam inventore neque pariatur eum dolor voluptas praesentium. Et tempora ratione minima. Distinctio necessitatibus et.

Illo aliquid tempore possimus consequatur sapiente enim. Voluptatum voluptatem vel. Qui quo ratione ea. In ut est vel qui aut consequuntur autem reprehenderit et. Perferendis error totam similique sunt ipsum maxime.

Rem voluptatum laborum quia aliquam qui qui consectetur. Impedit iure ut. Iusto necessitatibus ipsum aut reiciendis. Eos occaecati veritatis minima a vel debitis rerum et necessitatibus. Accusantium eum fuga. Ut ut possimus. Reiciendis molestiae inventore aut quis quidem illo.

Dolorem magni voluptatem omnis vitae eius expedita occaecati eum molestias. Est iste deserunt excepturi reiciendis soluta. Molestiae sed vero excepturi. Quia modi eum. Sint neque quis aspernatur vitae quis molestiae odit optio in.

Ipsam praesentium quae. Laborum rerum voluptas. Quo nisi et velit dicta cum. Accusamus accusantium rerum praesentium iure nisi. Eum dignissimos quia nulla mollitia nisi vel natus.","2017-10-08 20:10:69","7"
761,"33","75","4","5","5","5","3","1","Vel commodi dolorem. Quos officiis magnam molestiae. Laborum iusto eligendi inventore nam beatae qui minima assumenda tempore. Voluptatem alias dolorem cumque et aliquam debitis non illum est. Quod non ut animi est soluta. Earum laboriosam hic odit placeat nesciunt officiis laboriosam ea. Autem quam maxime ea et. Ut quo eum nobis.","2018-05-22 15:05:14","8"
762,"63","75","5","5","5","5","4","0","Asperiores suscipit quo id voluptatem. Sit incidunt eum. Occaecati voluptas molestias temporibus distinctio velit explicabo. Voluptatem facilis quia natus et aut sint. Aut dolor consequatur possimus exercitationem rerum.

Atque cumque earum dolorem. Harum dolorem reprehenderit omnis quas dolores a error est fugit. Optio porro voluptatum delectus enim aut molestiae quia. Voluptatem doloribus eum non porro. Recusandae quia placeat hic eligendi minus quaerat debitis ipsa. Ut ex est quia qui id consequatur quia.","2017-10-26 18:10:39","2"
763,"26","75","5","5","5","3","4","1","Non quia quidem doloribus fugiat eligendi deleniti totam ducimus quia. Doloribus deleniti omnis ut aliquid necessitatibus et.

Unde voluptatem at id aliquid cupiditate sit odit at illum. Tempore illum rerum rerum. Expedita eum nostrum est facere neque nesciunt. Enim id ut necessitatibus aperiam voluptatem doloremque aspernatur ea. Ullam laudantium et quos.

Voluptatem id delectus accusantium. Consequatur cum esse quas nisi quasi corrupti id sed ad. Ullam quidem eum. Consequuntur saepe neque quia. Sit sit qui. Nam possimus perferendis sunt iure.

Minus cumque qui inventore voluptate aut repellendus cupiditate facilis. Velit eos ipsum minus iste excepturi ab dolorem. Est corporis saepe ut minus dicta error dolorem porro.

Quo quis laboriosam placeat aut doloremque pariatur accusamus culpa dolor. Eius est vero ut et ullam. Dolores nam aut velit eum fugiat fuga totam. Nulla est nemo consequatur neque rerum. Officiis qui et id consequatur placeat et ipsam. Reprehenderit nihil quae officia laborum illo aut quisquam.","2018-10-21 00:10:72","5"
764,"51","75","5","1","5","5","5","1","Perferendis voluptatum atque. Cum ut unde molestiae. Ipsum aliquam ratione quisquam deleniti aut possimus voluptas est voluptatem. Molestias adipisci hic et voluptas voluptatem error rerum. Occaecati ad qui ullam tempora quia officia. Voluptate ratione ut enim voluptate asperiores velit culpa voluptatem cum.

Asperiores sit rerum aut libero quo. Quia ut illum quia tenetur temporibus animi animi deserunt voluptatibus. Nemo velit explicabo omnis natus autem. Eum aut accusamus occaecati facere eius eum nemo minima. Quae quia excepturi. Sunt qui id quo. Nostrum quia quas.","2017-10-25 17:10:80","2"
765,"1","76","5","5","5","5","5","0","Natus tempora sint. Et eligendi voluptatum neque in deserunt incidunt minima corporis. Repudiandae dolorem fugit soluta voluptates. Quia numquam officia.

Nisi atque eligendi eaque cum aut recusandae. Nobis deleniti voluptatibus perspiciatis quod qui earum. Laboriosam dolorem quo accusamus veniam iure corporis. Vel eos non possimus.

Vitae laudantium dolorem cum reiciendis. Placeat aut velit expedita facilis provident enim quaerat. Id consequuntur cupiditate est facilis quia consequatur soluta. Optio laborum dicta velit eos aspernatur numquam eveniet ut reprehenderit. Ipsam et cumque quis.","2018-07-14 11:07:14","2"
766,"47","76","5","2","5","5","5","0","Necessitatibus non voluptatum corrupti vitae unde. Adipisci aut saepe placeat quis blanditiis. Temporibus veniam magnam et dolor. Eum nemo consequatur corrupti ut veniam voluptates reprehenderit. Rem est quasi dolor quaerat sed ad aut hic.

Voluptas cupiditate cumque esse repellendus. Praesentium voluptatibus vero unde quam quia cum rerum officiis vel. Labore optio laudantium repellat veniam. Qui quo praesentium.

Est aut voluptatibus cumque asperiores ut iusto eum asperiores. Saepe autem itaque ipsam ut consequatur sit laudantium consequatur. Quia voluptas nisi. Veritatis cum exercitationem et repellendus voluptas recusandae expedita qui non. Consequatur sequi laborum recusandae laborum quos non qui deserunt nam.

Fuga quod reiciendis laborum. Nulla reiciendis doloribus esse sunt iusto.

Laudantium expedita quaerat magnam ex accusantium eaque quo voluptas. Non omnis harum ab atque aut repellat consequatur. Qui maiores facere consectetur voluptas deserunt quo tenetur dicta. Qui illo ut voluptate praesentium voluptatibus tempora.","2018-01-12 21:01:73","6"
767,"84","76","5","5","5","3","5","1","Et quos et. Quia ut id placeat voluptate ea. Voluptas iusto quae aut quas non ut.

Recusandae quisquam animi corrupti et facere iure. Nesciunt et illo. Explicabo consequatur perferendis. Et maxime omnis et dolor odit qui exercitationem saepe.

Possimus quia commodi cupiditate asperiores excepturi consequatur adipisci. Est debitis reiciendis possimus eum ut.","2018-08-23 21:08:82","2"
768,"35","76","2","3","5","5","5","0","Distinctio nisi qui eligendi soluta eos et nihil. Nostrum assumenda autem ipsam et animi nihil consequuntur sit consequatur. Ut magnam animi optio et voluptatem et voluptas aperiam fugit. Doloremque omnis ex et laboriosam cumque ab amet et id. Magnam quis ipsam eos suscipit praesentium.

Nihil quaerat architecto veritatis deleniti. Illum tempore aut eaque consectetur veniam quam ut. Omnis voluptatem harum repudiandae quia nulla. Iusto facere ratione occaecati.

Accusamus et et aspernatur ea adipisci. Itaque nobis qui ut tempore cupiditate. Exercitationem officia eligendi odio. Et libero eligendi temporibus. Quasi autem et neque voluptatem quibusdam. Et ea facilis ducimus sit.","2018-03-04 04:03:44","4"
769,"42","76","5","4","4","5","2","1","Consectetur eligendi nihil placeat alias qui quia officia. Quas necessitatibus vel itaque et dolorem. Dicta quia vel. Voluptates aliquam optio et et a est iste.

Ipsum aut et corrupti sapiente dolorem temporibus. Impedit ut sed aperiam. Sapiente eum commodi nobis neque suscipit ea maiores molestiae. Qui cupiditate similique repudiandae consequatur est reiciendis neque. Molestias ut impedit.","2018-10-08 01:10:87","3"
770,"67","76","5","5","5","5","4","1","Itaque eum qui dolor. Magni sunt molestias. Neque nemo sint nesciunt quisquam provident voluptatem consequatur architecto. Maiores consequatur pariatur mollitia.

Recusandae est officia in molestias tenetur nesciunt est. Nihil et illo sit quaerat ullam est. Esse aut consequatur aut blanditiis vel consequuntur eos nemo libero. Aliquid eum eos. Blanditiis excepturi minima aut assumenda quia ut laborum.","2018-09-26 18:09:47","3"
771,"90","76","5","2","5","5","5","1","Totam qui minima et hic quasi. Illum sequi possimus sunt. Distinctio hic eum amet harum. Qui dolores velit mollitia. Quasi unde odit consectetur sequi ea consequatur inventore. Dolorem quas autem ipsum totam nesciunt velit vero. Natus non voluptatem dolor. At eligendi non dicta veritatis id.

Mollitia praesentium et esse aut quas delectus. Enim voluptatem quos et et qui dolores suscipit. Eveniet voluptate et rem labore vitae quia eos. In velit velit soluta enim natus ullam inventore minima sapiente. Pariatur aliquam cupiditate ad sed voluptatem ut rerum dolor aut.","2017-10-19 09:10:98","5"
772,"87","76","2","5","5","4","5","1","Doloremque est suscipit hic. Minus nihil eum eos voluptate.

Tenetur consequatur voluptatem quasi mollitia beatae necessitatibus. Ducimus ut consequuntur. Totam qui et mollitia omnis in eum voluptatum vel. Et ut quod qui ullam provident. Voluptatem et debitis et sunt. Repellendus dolorem aut qui et aperiam. Consequatur sed saepe a.","2018-05-22 10:05:15","2"
773,"79","76","4","5","4","5","5","0","Labore sit rerum voluptatem beatae. Non nihil hic quia magnam incidunt quia doloribus. Necessitatibus est beatae voluptatibus eos aut illum. Porro ut sed blanditiis aut voluptatum velit. Aut nemo pariatur repellat.

Eum provident aut eligendi est. Velit commodi consequatur doloremque nulla numquam et officiis assumenda quae. Vel voluptas adipisci sint quia aut ipsa voluptatem. Debitis ut voluptatibus amet.

Ratione et voluptatem perspiciatis sint. Quo porro eum ad deleniti. Ipsa vero aut dolore quae voluptas qui. Excepturi fugit rerum illum omnis nemo dolorem natus. Sed nesciunt suscipit quidem pariatur voluptas corporis. Ea corporis similique similique facilis magnam placeat a.","2018-06-08 21:06:65","2"
774,"26","76","5","5","5","4","5","0","Itaque magnam eaque. Culpa rerum accusantium odio quia vel nulla est voluptatem et. Quaerat facilis non at. Ut maiores autem.

Est officiis mollitia non consequuntur dolorum eos. Saepe qui harum. Laudantium impedit quo a ducimus ducimus aspernatur dolorem soluta eum. Delectus in doloremque assumenda aspernatur et laudantium. Nostrum voluptatem id.

Sed eum temporibus earum necessitatibus consequatur quia. Sit possimus odio dolorum recusandae dolore nostrum eveniet voluptas. Architecto eos accusantium sit sed delectus facere. Enim aut doloribus eveniet fuga provident. Quis consectetur sint atque.

Ut omnis eveniet quidem porro a rem veritatis. Ducimus dolor aut ratione id quia dolor explicabo iste quos. Consectetur qui qui recusandae harum animi laborum id. Enim et quaerat atque nostrum ipsum similique eos molestias odit.","2018-04-06 15:04:78","6"
